{
  "schema_version": "1.0",
  "mission_id": "MISSION-PHASE0-CONTRACTS",
  "role": "Independent Reviewer",
  "status": "PASS",
  "evidence": [
    { "path": "scripts/ai-orchestrator/schemas/mission.schema.json", "line": 1, "claim": "Mission schema contains all required Phase 0 fields." }
  ],
  "changed_files": ["scripts/ai-orchestrator/schemas/mission.schema.json"],
  "risks": ["The validator intentionally supports only the schema keywords used by Phase 0."],
  "validation_errors": [],
  "next_action": "Request Change Approval from the human owner."
}
